Question,Answer 1,Answer 2,Answer 3,Answer 4,Answer 5,Answer 6
After work you can often be found consuming,Martinis,Herbal tea (or just herb),Craft Services,Netflix,,
Social network?,LinkedIn,Facebook,Instagram,Tinder,,
Sunday activity?,Making deals,Planning the week ahead,Relaxing,Cutting loose,,
You can often be found traveling by,Stretch Limo,Boat,Gulfstream,Police Cruiser,,
What keeps you up at night?,Finances,Anxiety about tomorrow,Insomnia,Politics or news,,
Favorite movie?,Episode IV - A New Hope,Star Wars Holiday Special,Episode I - The Phantom Menace,Episode VII - The Force Awakens,Rogue One - A Star Wars Story,Solo - A Star Wars Story
Celebrity crush?,Hayden Christensen as Anakin Skywalker,Hayden Christensen as Darth Vader,Billy Dee Williams as Lando Calrissian,Lindsay Duncan as the voice of TC-14,Ahmed Best as Jar Jar Binks,Sy Snootles as herself